url,latitude,longitude,date,height,width,media,copyRight,country,address,keyword,source
https://s-ec.bstatic.com/images/hotel/max1280x900/574/57490493.jpg,51.2205835930373,6.79864481091499,,,,,,Germany,2; Ludwig-Erhard-Allee; Oberbilk; Stadtbezirk 3; Dusseldorf; North Rhine-Westphalia; 40227; Germany,hotel,cameraforensics
https://live.staticflickr.com/8065/8220504276_b88f1e9591_o.jpg,51.223575,6.7994616666666685,,,,,,Germany,30; Erkrather Straße; Flingern Süd; Stadtbezirk 2; Dusseldorf; North Rhine-Westphalia; 40233; Germany,hotel,cameraforensics
https://live.staticflickr.com/7153/13968371693_d796f38e70_o.jpg,51.21646333333333,6.80355333333333,,,,,,Germany,Alexander Pushkin; Oberbilker Markt U; Oberbilk; Stadtbezirk 3; Dusseldorf; North Rhine-Westphalia; 40227; Germany,hotel,cameraforensics
https://live.staticflickr.com/7071/7164434479_ddd3f73462_o.jpg,51.217,6.8105,,,,,,Germany,40; Fichtenstraße; Flingern Süd; Stadtbezirk 2; Dusseldorf; North Rhine-Westphalia; 40233; Germany,hotel,cameraforensics
https://live.staticflickr.com/8460/28944950976_1509397dc2_o.jpg,52.49925277777778,13.322005555555561,,,,,,Germany,5; Pfalzburger Straße; Wilmersdorf; Charlottenburg-Wilmersdorf; Berlin; 10719; Germany,hotel,cameraforensics
https://live.staticflickr.com/5344/9917232455_88d16fd20c_o.jpg,52.49616666666667,13.30933333333333,,,,,,Germany,24; Zähringerstraße; Wilmersdorf; Charlottenburg-Wilmersdorf; Berlin; 10707; Germany,hotel,cameraforensics
https://live.staticflickr.com/3872/14529542429_8b21498b80_o.jpg,52.50183333333333,13.3215,,,,,,Germany,Capone; 202; Kurfürstendamm; Charlottenburg; Charlottenburg-Wilmersdorf; Berlin; 10719; Germany,hotel,cameraforensics
https://s-ec.bstatic.com/images/hotel/max1280x900/130/130691284.jpg,52.500462953295,13.3150295912674,,,,,,Germany,28; Wielandstraße; Charlottenburg; Charlottenburg-Wilmersdorf; Berlin; 10707; Germany,hotel,cameraforensics
https://t-ec.bstatic.com/images/hotel/max1280x900/446/44601942.jpg,52.5021953830727,13.3061116933823,,,,,,Germany,23; Waitzstraße; Charlottenburg; Charlottenburg-Wilmersdorf; Berlin; 10629; Germany,hotel,cameraforensics
https://s-ec.bstatic.com/images/hotel/max1280x900/110/110995164.jpg,52.4935965130915,13.319709151983302,,,,,,Germany,Centro Hotel; 6; Emser Straße; Wilmersdorf; Charlottenburg-Wilmersdorf; Berlin; 10719; Germany,hotel,cameraforensics
https://t-ec.bstatic.com/images/hotel/max1280x900/255/25560384.jpg,52.501716170139,13.3187140524387,,,,,,Germany,Buddy Bear; Kurfürstendamm; Charlottenburg; Charlottenburg-Wilmersdorf; Berlin; 10707; Germany,hotel,cameraforensics
https://s-ec.bstatic.com/images/hotel/max1280x900/105/105989512.jpg,52.4958027261365,13.3086343109608,,,,,,Germany,21; Brandenburgische Straße; Wilmersdorf; Charlottenburg-Wilmersdorf; Berlin; 10707; Germany,hotel,cameraforensics
https://live.staticflickr.com/6217/6327669509_250821778f_o.jpg,52.49925500000555,13.32143,,,,,,Germany,Adagio Berlin Kurfürstendamm; 89a; Lietzenburger Straße; Charlottenburg; Charlottenburg-Wilmersdorf; Berlin; 10719; Germany,hotel,cameraforensics
https://s-ec.bstatic.com/images/hotel/max1280x900/128/128594490.jpg,52.5037493,13.3169897,,,,,,Germany,31; Schlüterstraße; Charlottenburg; Charlottenburg-Wilmersdorf; Berlin; 10629; Germany,hotel,cameraforensics
https://live.staticflickr.com/3942/15542032932_4070884a52_o.jpg,50.943805,6.93412666999472,,,,,,Germany,Bahnhof Köln West; 2; Hans-Böckler-Platz; Belgisches Viertel; Neustadt/Nord; Innenstadt; Cologne; North Rhine-Westphalia; 50672; Germany,hotel,cameraforensics
https://live.staticflickr.com/7744/17983046295_5ce6d569d6_o.jpg,50.939075,6.95304722222222,,,,,,Germany,WDR-Arkaden; Tunisstraße; Altstadt-Nord; Innenstadt; Cologne; North Rhine-Westphalia; 50667; Germany,hotel,cameraforensics
https://live.staticflickr.com/1615/26702869406_f4793e2b8a_o.jpg,50.93989444444443,6.953230555555559,,,,,,Germany,Tunisstraße; Altstadt-Nord; Innenstadt; Cologne; North Rhine-Westphalia; 50667; Germany,hotel,cameraforensics
https://live.staticflickr.com/5481/30488296401_89b67b390f_o.jpg,50.94641388888889,6.94281666666667,,,,,,Germany,Erftstraße; Neustadt/Nord; Innenstadt; Cologne; North Rhine-Westphalia; 50672; Germany,hotel,cameraforensics
https://live.staticflickr.com/5612/14912250124_e76b9271b8_o.jpg,50.94426666999721,6.934426670000559,,,,,,Germany,13; Venloer Wall; Belgisches Viertel; Neustadt/Nord; Innenstadt; Cologne; North Rhine-Westphalia; 50672; Germany,hotel,cameraforensics
http://static.panoramio.com/photos/original/102889518.jpg,50.947185,6.94297,,,,,,Germany,Aquädukt; Im Mediapark; Mediapark; Neustadt/Nord; Innenstadt; Cologne; North Rhine-Westphalia; 50670; Germany,hotel,cameraforensics
https://live.staticflickr.com/8190/28341706470_782085227c_o.jpg,49.47086388888889,10.995202777777779,,,,,,Germany,39; Rudolf-Breitscheid-Straße; Südstadt; Fürth; Bavaria; 90762; Germany,hotel,cameraforensics
https://live.staticflickr.com/7418/11106192235_7a41b79bf6_o.jpg,49.47471388888889,10.98884166666667,,,,,,Germany,26; Schwabacher Straße; Innenstadt; Fürth; Bavaria; 90762; Germany,hotel,cameraforensics
https://r-cf.bstatic.com/images/hotel/max1280x900/227/227400177.jpg,49.47253,10.987969999999999,,,,,,Germany,48; Schwabacher Straße; Innenstadt; Fürth; Bavaria; 90762; Germany,hotel,cameraforensics
https://live.staticflickr.com/2311/5816360694_b57d17a433_o.jpg,49.47380760175,10.99326425171389,,,,,,Germany,135; Königstraße; Innenstadt; Fürth; Bavaria; 90762; Germany,hotel,cameraforensics
https://t-ec.bstatic.com/images/hotel/max1280x900/472/47299237.jpg,49.470139386338,10.9990713000298,,,,,,Germany,Quality Hotel Bavaria; 54; Nürnberger Straße; Südstadt; Fürth; Bavaria; 90762; Germany,hotel,cameraforensics
https://live.staticflickr.com/3681/12413078023_7f266ab920_o.jpg,49.46762777777778,10.990602777777779,,,,,,Germany,2; Benno-Mayer-Straße; Südstadt; Fürth; Bavaria; 90763; Germany,hotel,cameraforensics
https://live.staticflickr.com/712/23260871762_00f1f85d88_o.jpg,49.47585833333333,10.9859,,,,,,Germany,8; Hallemannstraße; Innenstadt; Fürth; Bavaria; 90762; Germany,hotel,cameraforensics
http://static.panoramio.com/photos/original/90429692.jpg,49.478646999999995,10.987544999999999,,,,,,Germany,59; Königstraße; Altstadt; Fürth; Bavaria; 90762; Germany,hotel,cameraforensics
https://live.staticflickr.com/2487/33027096585_24e23d873d_o.jpg,49.47262222222222,10.992527777777779,,,,,,Germany,Milchhäusle; Moststraße; Innenstadt; Fürth; Bavaria; 90762; Germany,hotel,cameraforensics
http://static.panoramio.com/photos/original/90216069.jpg,49.479620000000004,10.992303999999999,,,,,,Germany,Ludwigsbrücke; Erlanger Straße; Altstadt; Fürth; Bavaria; Germany,hotel,cameraforensics
https://live.staticflickr.com/8505/8564043359_e94d429851_o.jpg,48.778166666666664,9.177999999999999,,,,,,Germany,Crinkly avec disque rouge; Königstraße; Neue Vorstadt; Stuttgart-Mitte; Stuttgart; Baden-Württemberg; 70173; Germany,hotel,cameraforensics
https://live.staticflickr.com/575/21748590999_0e43c30a83_o.jpg,50.947419444444435,6.96154444444444,,,,,,Germany,St. Marien-Hospital; 11-13; Kunibertskloster; Kunibertsviertel; Altstadt-Nord; Innenstadt; Cologne; North Rhine-Westphalia; 50668; Germany,hotel,cameraforensics
https://live.staticflickr.com/5709/21376102169_60698b5c46_o.jpg,52.50986944444447,13.34450555555556,,,,,,Germany,Berlin Zoological Garden; 8; Hardenbergplatz; Tiergarten; Charlottenburg-Wilmersdorf; Berlin; 10787; Germany,hotel,cameraforensics
https://live.staticflickr.com/8628/27947536584_3fb6b5bff5_o.jpg,52.505375,13.33753888888889,,,,,,Germany,Bikini Berlin; Breitscheidplatz; Zoobogen; Charlottenburg; Charlottenburg-Wilmersdorf; Berlin; 10787; Germany,hotel,cameraforensics
https://drscdn.500px.org/photo/212534427/m%3D2048_k%3D1_a%3D1/cc021601b8d696d1cf61f8713fb07b76,52.505565000000004,13.333833333333333,,,,,,Germany,U Zoologischer Garten; Hardenbergstraße; Charlottenburg; Charlottenburg-Wilmersdorf; Berlin; 10623; Germany,hotel,cameraforensics
https://live.staticflickr.com/7724/17627915332_b9fd727108_o.jpg,52.50576388888889,13.35470555555556,,,,,,Germany,Sheraton Berlin Grand Hotel Esplanade; 15; Lützowufer; Botschaftsviertel; Tiergarten; Mitte; Berlin; 10785; Germany,hotel,cameraforensics
https://live.staticflickr.com/7197/26267962534_d9bbda808d_o.jpg,52.5054138888889,13.340572222222221,,,,,,Germany,Elefantentor; Budapester Straße; Tiergarten; Mitte; Berlin; 10787; Germany,hotel,cameraforensics
https://live.staticflickr.com/7326/10959371245_511411ecc7_o.jpg,52.508,13.33633333333333,,,,,,Germany,Berlin Zoological Garden; 8; Hardenbergplatz; Tiergarten; Charlottenburg-Wilmersdorf; Berlin; 10787; Germany,hotel,cameraforensics
https://live.staticflickr.com/698/21447840425_80e40bd0ec_o.jpg,52.50566666666667,13.35233333333333,,,,,,Germany,Herkulesbrücke; Lützowplatz; Botschaftsviertel; Tiergarten; Mitte; Berlin; 10785; Germany,hotel,cameraforensics
https://live.staticflickr.com/7430/9124925009_8973d76f4d_o.jpg,52.5,13.35266666666667,,,,,,Germany,Hotel Gaijin; Kleiststraße; Schöneberg; Tempelhof-Schöneberg; Berlin; 10777; Germany,hotel,cameraforensics
https://live.staticflickr.com/289/32637190471_a5777ba00c_o.jpg,52.50545500000001,13.338621138888893,,,,,,Germany,38; Budapester Straße; Tiergarten; Mitte; Berlin; 10787; Germany,hotel,cameraforensics
https://live.staticflickr.com/298/31905236544_e215a6d5d5_o.jpg,52.50513075,13.33868216666667,,,,,,Germany,Palace Berlin; 45; Budapester Straße; Tiergarten; Mitte; Berlin; 10787; Germany,hotel,cameraforensics
http://static.panoramio.com/photos/original/76843578.jpg,49.7945,9.938203,,,,,,Germany,Rotkreuzklinik; 2; Kapuzinerstraße; Altstadt; Würzburg Altstadt; Würzburg; Bavaria; 97070; Germany,hotel,cameraforensics
https://live.staticflickr.com/1526/26669468966_02f3c5098c_o.jpg,49.793197222222226,9.94020277777778,,,,,,Germany,Oegg-Denkmal; Rennweg; Altstadt; Würzburg Altstadt; Würzburg; Bavaria; 97070; Germany,hotel,cameraforensics
https://live.staticflickr.com/5017/5460988077_21a61947e1_o.jpg,49.792728333333336,9.94117833333333,,,,,,Germany,Rennweg; Altstadt; Würzburg Altstadt; Würzburg; Bavaria; 97070; Germany,hotel,cameraforensics
https://q-cf.bstatic.com/images/hotel/max1280x900/204/204158815.jpg,49.794134,9.948888900000002,,,,,,Germany,7; Sartoriusstraße; Altstadt; Würzburg Altstadt; Würzburg; Bavaria; 97072; Germany,hotel,cameraforensics
http://static.panoramio.com/photos/original/76137257.jpg,49.796137,9.934907,,,,,,Germany,Bürgerspital Weinhaus; 2; Semmelstraße; Altstadt; Würzburg Altstadt; Würzburg; Bavaria; 97070; Germany,hotel,cameraforensics
https://t-ec.bstatic.com/images/hotel/max1280x900/102/102919140.jpg,49.79732776369561,9.9349093436922,,,,,,Germany,15; Textorstraße; Altstadt; Würzburg Altstadt; Würzburg; Bavaria; 97070; Germany,hotel,cameraforensics
https://t-ec.bstatic.com/images/hotel/max1280x900/452/45288648.jpg,49.7968488512344,9.94141727685928,,,,,,Germany,Dorint Hotel Würzburg; 2; Eichstraße; Altstadt; Würzburg Altstadt; Würzburg; Bavaria; 97070; Germany,hotel,cameraforensics
https://r-cf.bstatic.com/images/hotel/max1280x900/851/85157446.jpg,49.79712168,9.93699457,,,,,,Germany,City Hotel Würzburg; 28+30; Semmelstraße; Altstadt; Würzburg Altstadt; Würzburg; Bavaria; 97070; Germany,hotel,cameraforensics
http://static.panoramio.com/photos/original/76843762.jpg,49.797948999999996,9.94192,,,,,,Germany,Sozialgericht Würzburg; 33; Ludwigstraße; Altstadt; Würzburg Altstadt; Würzburg; Bavaria; 97070; Germany,hotel,cameraforensics
https://t-ec.bstatic.com/images/hotel/max1280x900/902/90237433.jpg,49.7964078801577,9.93857704097536,,,,,,Germany,Hotel Amberger; 17-19; Ludwigstraße; Altstadt; Würzburg Altstadt; Würzburg; Bavaria; 97070; Germany,hotel,cameraforensics
https://live.staticflickr.com/588/22611817854_60b21f4fa8_o.jpg,48.11177719116111,11.57543275197222,,,,,,Germany,Candidstraße; Bezirksteil Obergiesing; Obergiesing-Fasangarten; Munich; Bavaria; 81539; Germany,hotel,cameraforensics
https://live.staticflickr.com/7283/16323462113_aea674352e_o.jpg,48.11686333333333,11.58013,,,,,,Germany,14; Gietlstraße; Bezirksteil Obergiesing; Obergiesing-Fasangarten; Munich; Bavaria; 81541; Germany,hotel,cameraforensics
https://live.staticflickr.com/945/41037755515_e4a91217ed_o.jpg,48.11138833333333,11.57472166666667,,,,,,Germany,Städtisches Stadion an der Grünwalder Straße; Grünwalder Straße; Bezirksteil Giesing; Untergiesing-Harlaching; Munich; Bavaria; 81547; Germany,hotel,cameraforensics
https://s-ec.bstatic.com/images/hotel/max1280x900/125/125335175.jpg,48.117161706741285,11.5905976295471,,,,,,Germany,38; Sankt-Martin-Straße; Bezirksteil Obergiesing; Obergiesing-Fasangarten; Munich; Bavaria; 81541; Germany,hotel,cameraforensics
https://live.staticflickr.com/1670/26426063610_ccedc39f70_o.jpg,48.11003333333333,11.580033333333333,,,,,,Germany,Werner-Schlierf-Straße; Parkviertel Giesing; Obergiesing-Fasangarten; Munich; Bavaria; 81539; Germany,hotel,cameraforensics
https://live.staticflickr.com/65535/32902393767_10424b413d_o.jpg,48.11560833333333,11.58025555555556,,,,,,Germany,"Gedenksäule ""Giesinger Feldkreuz""; Werinherstraße; Bezirksteil Obergiesing; Obergiesing-Fasangarten; Munich; Bavaria; 81541; Germany",hotel,cameraforensics
https://live.staticflickr.com/7070/6785056484_0267131a9d_o.jpg,48.11746333333333,11.575013333333333,,,,,,Germany,3; Voßstraße; Bezirksteil Untergiesing; Untergiesing-Harlaching; Munich; Bavaria; 81543; Germany,hotel,cameraforensics
https://live.staticflickr.com/4002/4196094803_a2b29f693a_o.jpg,48.11188638888889,11.57432583333333,,,,,,Germany,Candidstraße; Bezirksteil Giesing; Untergiesing-Harlaching; Munich; Bavaria; 81539; Germany,hotel,cameraforensics
https://t-ec.bstatic.com/images/hotel/max1280x900/285/28586544.jpg,48.1087923361976,11.57989628613,,,,,,Germany,One Lounge; 140; Weißenseestraße; Bezirksteil Obergiesing; Obergiesing-Fasangarten; Munich; Bavaria; 81539; Germany,hotel,cameraforensics
https://q-cf.bstatic.com/images/hotel/max1280x900/155/155839344.jpg,48.1152174,11.5916785,,,,,,Germany,49; Werinherstraße; Bezirksteil Obergiesing; Obergiesing-Fasangarten; Munich; Bavaria; 81541; Germany,hotel,cameraforensics
http://static.panoramio.com/photos/original/91200023.jpg,52.516481666666664,13.37710833333333,,,,,,Germany,L 009; Ebertstraße; Mitte; Berlin; 10117; Germany,hotel,cameraforensics
https://live.staticflickr.com/2925/14483198330_03389245f0_o.jpg,52.51455277777778,13.37803611111111,,,,,,Germany,Memorial to the Murdered Jews of Europe; 1; Cora-Berliner-Straße; Mitte; Berlin; 10117; Germany,hotel,cameraforensics
https://live.staticflickr.com/5627/21955998536_1d1398d02c_o.jpg,52.51638666666667,13.37680333333333,,,,,,Germany,Ebertstraße; Mitte; Berlin; 10117; Germany,hotel,cameraforensics
https://live.staticflickr.com/8075/29340671640_e3cc7a97ae_o.jpg,52.516275,13.38115,,,,,,Germany,Abgeordnetenbüros des Deutschen Bundesstags; Wilhelmstraße; Mitte; Berlin; 10117; Germany,hotel,cameraforensics
https://live.staticflickr.com/7288/27276327462_44ee07ba1c_o.jpg,52.51649166666667,13.378752777777779,,,,,,Germany,Pariser Platz; Mitte; Berlin; 10117; Germany,hotel,cameraforensics
https://live.staticflickr.com/8752/17634048295_b83598ed12_o.jpg,52.506944999999995,13.38333333333333,,,,,,Germany,Topography of Terror; 8; Niederkirchnerstraße; Kreuzberg; Mitte; Berlin; 10963; Germany,hotel,cameraforensics
https://live.staticflickr.com/7373/14149254872_55de2f797f_o.jpg,52.51640833333333,13.38091333333333,,,,,,Germany,S Brandenburger Tor; Wilhelmstraße; Mitte; Berlin; 10117; Germany,hotel,cameraforensics
https://live.staticflickr.com/2950/15447688411_3befca257a_o.jpg,52.51006333333333,13.38128333333333,,,,,,Germany,Mall of Berlin; 12; Leipziger Platz; Mitte; Berlin; 10117; Germany,hotel,cameraforensics
https://live.staticflickr.com/5611/15693804101_ce0f53fa78_o.jpg,50.95825555555553,6.9925833333333305,,,,,,Germany,Katzenbuckel; Mülheim; Cologne; North Rhine-Westphalia; 51063; Germany,hotel,cameraforensics
https://live.staticflickr.com/4027/34892624443_86bcc61d8b_o.jpg,50.95536666666667,6.989563888888887,,,,,,Germany,The New Yorker Dock One; 1; Hafenstraße; Stegerwaldsiedlung; Mülheim; Cologne; North Rhine-Westphalia; 51063; Germany,hotel,cameraforensics
https://live.staticflickr.com/5751/22401516575_589afac37e_o.jpg,50.94541666666667,6.99295,,,,,,Germany,Stadtautobahn; Deutz; Innenstadt; Cologne; North Rhine-Westphalia; 50679; Germany,hotel,cameraforensics
https://r-cf.bstatic.com/images/hotel/max1280x900/960/96013508.jpg,50.94773002,6.98780817,,,,,,Germany,23; Ferdinandstraße; Stegerwaldsiedlung; Mülheim; Cologne; North Rhine-Westphalia; 51063; Germany,hotel,cameraforensics
https://live.staticflickr.com/2748/4553630809_e72f8cdcb2_o.jpg,50.95,6.9826666666666695,,,,,,Germany,Zoobrücke; Stegerwaldsiedlung; Mülheim; Cologne; North Rhine-Westphalia; 51063; Germany,hotel,cameraforensics
https://live.staticflickr.com/7305/9561108717_c338d9d3c8_o.jpg,50.94786069444444,6.98061419444444,,,,,,Germany,Halle 7; Auenweg; Deutz; Innenstadt; Cologne; North Rhine-Westphalia; 50679; Germany,hotel,cameraforensics
https://r-cf.bstatic.com/images/hotel/max1280x900/134/134627959.jpg,50.94956002,6.9874682,,,,,,Germany,150; Deutz-Mülheimer Straße; Stegerwaldsiedlung; Mülheim; Cologne; North Rhine-Westphalia; 51063; Germany,hotel,cameraforensics
https://live.staticflickr.com/5087/5345440197_252ea18375_o.jpg,50.94883333333333,6.98666666666667,,,,,,Germany,129; Deutz-Mülheimer Straße; Stegerwaldsiedlung; Mülheim; Cologne; North Rhine-Westphalia; 51063; Germany,hotel,cameraforensics
https://t-ec.bstatic.com/images/hotel/max1280x900/136/136420246.jpg,50.9704340015024,11.329919099807697,,,,,,Germany,Arthotel Weimar; 3A; Freiherr-vom-Stein-Allee; Südstadt; Weimar; Thuringia; 99425; Germany,hotel,cameraforensics
https://r-cf.bstatic.com/images/hotel/max1280x900/429/42976498.jpg,50.96626,11.34361,,,,,,Germany,17; Mittelstraße; Oberweimar; Weimar; Thuringia; 99425; Germany,hotel,cameraforensics
https://live.staticflickr.com/5791/31395019756_21c8398e70_o.jpg,50.965602777777775,11.34375833333333,,,,,,Germany,3; Ilmstraße; Oberweimar; Weimar; Thuringia; 99425; Germany,hotel,cameraforensics
https://t-ec.bstatic.com/images/hotel/max1280x900/106/106653277.jpg,50.9704340015024,11.329919099807697,,,,,,Germany,Arthotel Weimar; 3A; Freiherr-vom-Stein-Allee; Südstadt; Weimar; Thuringia; 99425; Germany,hotel,cameraforensics
https://t-ec.bstatic.com/images/hotel/max1280x900/337/33703343.jpg,50.9671402484588,11.337032318115199,,,,,,Germany,Leonardo Hotel; 25; Belvederer Allee; Südstadt; Weimar; Thuringia; 99425; Germany,hotel,cameraforensics
https://t-ec.bstatic.com/images/hotel/max1280x900/136/136421560.jpg,50.9704340015024,11.329919099807697,,,,,,Germany,Arthotel Weimar; 3A; Freiherr-vom-Stein-Allee; Südstadt; Weimar; Thuringia; 99425; Germany,hotel,cameraforensics
https://live.staticflickr.com/3304/4617088398_6b5a256c7e_o.jpg,50.97319720001389,11.33615255,,,,,,Germany,Duxbrücke; Parkvorstadt; Weimar; Thuringia; 99425; Germany,hotel,cameraforensics
https://r-cf.bstatic.com/images/hotel/max1280x900/689/68960375.jpg,50.96568057,11.34589982,,,,,,Germany,Pension Scharfer Kessel; 1; Taubacher Straße; Oberweimar; Weimar; Thuringia; 99425; Germany,hotel,cameraforensics
https://live.staticflickr.com/7639/27570693146_714ecc5ca8_o.jpg,50.973236111111106,11.33603888888889,,,,,,Germany,Duxbrücke; Parkvorstadt; Weimar; Thuringia; 99425; Germany,hotel,cameraforensics
https://q-cf.bstatic.com/images/hotel/max1280x900/336/33649472.jpg,50.96626,11.34361,,,,,,Germany,17; Mittelstraße; Oberweimar; Weimar; Thuringia; 99425; Germany,hotel,cameraforensics
https://live.staticflickr.com/7390/27832240465_aeb94dfe91_o.jpg,47.465511111111105,11.045025,,,,,,Germany,2; Höllentalstraße; Schmölz; Hammersbach; Grainau; Landkreis Garmisch-Partenkirchen; Bavaria; 82491; Germany,hotel,cameraforensics
https://q-cf.bstatic.com/images/hotel/max1280x900/123/123539488.jpg,47.470420000000004,11.043389999999999,,,,,,Germany,9; Hölzlweg; Schmölz; Hammersbach; Grainau; Landkreis Garmisch-Partenkirchen; Bavaria; 82491; Germany,hotel,cameraforensics
https://q-cf.bstatic.com/images/hotel/max1280x900/203/203606247.jpg,47.46632,11.0463319,,,,,,Germany,10; Breitackerweg; Schmölz; Hammersbach; Grainau; Landkreis Garmisch-Partenkirchen; Bavaria; 82491; Germany,hotel,cameraforensics
https://live.staticflickr.com/7222/27832240755_ff92132ff4_o.jpg,47.46500833333333,11.045413888888893,,,,,,Germany,Mariä Himmelfahrt; 2A; Kreuzeckweg; Schmölz; Hammersbach; Grainau; Landkreis Garmisch-Partenkirchen; Bavaria; 82491; Germany,hotel,cameraforensics
https://r-cf.bstatic.com/images/hotel/max1280x900/203/203616422.jpg,47.46632,11.0463319,,,,,,Germany,10; Breitackerweg; Schmölz; Hammersbach; Grainau; Landkreis Garmisch-Partenkirchen; Bavaria; 82491; Germany,hotel,cameraforensics
https://q-cf.bstatic.com/images/hotel/max1280x900/203/203528653.jpg,47.46632,11.0463319,,,,,,Germany,10; Breitackerweg; Schmölz; Hammersbach; Grainau; Landkreis Garmisch-Partenkirchen; Bavaria; 82491; Germany,hotel,cameraforensics
https://r-cf.bstatic.com/images/hotel/max1280x900/132/132134755.jpg,47.47181,11.04481,,,,,,Germany,Fewo Haus Renate; 116; Zugspitzstraße; Schmölz; Hammersbach; Grainau; Landkreis Garmisch-Partenkirchen; Bavaria; 82491; Germany,hotel,cameraforensics
https://s-ec.bstatic.com/images/hotel/max1280x900/373/37364589.jpg,47.4651437473454,11.0458597540855,,,,,,Germany,Berghotel Hammersbach; 4; Kreuzeckweg; Schmölz; Hammersbach; Grainau; Landkreis Garmisch-Partenkirchen; Bavaria; 82491; Germany,hotel,cameraforensics
https://live.staticflickr.com/2443/3676495256_6f76523d1f_o.jpg,47.4596655,11.04194633333333,,,,,,Germany,Höhenweg Eibsee-Höllental; Obergrainau; Hammersbach; Grainau; Landkreis Garmisch-Partenkirchen; Bavaria; 82491; Germany,hotel,cameraforensics
https://s-ec.bstatic.com/images/hotel/max1280x900/129/129151762.jpg,47.4716439429205,11.047305464744596,,,,,,Germany,8; Längenfelderstraße; Schmölz; Hammersbach; Grainau; Landkreis Garmisch-Partenkirchen; Bavaria; 82491; Germany,hotel,cameraforensics
https://live.staticflickr.com/1621/23924671150_8ccd5459cc_o.jpg,52.50588333333334,13.29799444444444,,,,,,Germany,DaWanda GmbH; 18; Windscheidstraße; Charlottenburg; Charlottenburg-Wilmersdorf; Berlin; 10627; Germany,hotel,cameraforensics
https://live.staticflickr.com/3402/3632107965_9309768a7a_o.jpg,52.50583333333334,13.3175,,,,,,Germany,DEALLEGO0000341;DEALLEGO0000342; Schlüterstraße; Charlottenburg; Charlottenburg-Wilmersdorf; Berlin; 10625; Germany,hotel,cameraforensics
https://live.staticflickr.com/3652/3648603840_8da70636bf_o.jpg,52.5055,13.30283333333333,,,,,,Germany,Albert’s Restaurant; Stuttgarter Platz; Charlottenburg; Charlottenburg-Wilmersdorf; Berlin; 10627; Germany,hotel,cameraforensics
https://live.staticflickr.com/7375/12220740795_8464b73eff_o.jpg,52.50766666666667,13.302,,,,,,Germany,46; Kaiser-Friedrich-Straße; Charlottenburg; Charlottenburg-Wilmersdorf; Berlin; 10627; Germany,hotel,cameraforensics
https://r-cf.bstatic.com/images/hotel/max1280x900/137/137049755.jpg,52.50924297,13.30160615,,,,,,Germany,39; Kaiser-Friedrich-Straße; Charlottenburg; Charlottenburg-Wilmersdorf; Berlin; 10627; Germany,hotel,cameraforensics
https://live.staticflickr.com/2833/10979631383_d5bac020e3_o.jpg,52.50683333333333,13.3045,,,,,,Germany,62; Kantstraße; Charlottenburg; Charlottenburg-Wilmersdorf; Berlin; 10627; Germany,hotel,cameraforensics
https://live.staticflickr.com/5479/14052429518_9fabaa38ab_o.jpg,52.510197222222224,13.31026388888889,,,,,,Germany,92; Schillerstraße; Charlottenburg; Charlottenburg-Wilmersdorf; Berlin; 10625; Germany,hotel,cameraforensics
https://live.staticflickr.com/7436/8937552076_47117bba67_o.jpg,52.508,13.31183333333333,,,,,,Germany,Tinnappelmetz Retail; 23; Pestalozzistraße; Charlottenburg; Charlottenburg-Wilmersdorf; Berlin; 10625; Germany,hotel,cameraforensics
https://live.staticflickr.com/467/30948333484_66261aa1cb_o.jpg,52.49906666666666,13.32465555555556,,,,,,Germany,Siegfried Simon Hirschfeld; Uhlandstraße; Wilmersdorf; Charlottenburg-Wilmersdorf; Berlin; 10719; Germany,hotel,cameraforensics
https://live.staticflickr.com/2949/33729404436_986f52f720_o.jpg,52.50595555555557,13.32378333333333,,,,,,Germany,Stilwerk; Kantstraße; Charlottenburg; Charlottenburg-Wilmersdorf; Berlin; 10623; Germany,hotel,cameraforensics
https://live.staticflickr.com/8747/16858311620_9077107335_o.jpg,52.50345555555555,13.327525,,,,,,Germany,Rent a bike; Fasanenstraße; Charlottenburg; Charlottenburg-Wilmersdorf; Berlin; Germany,hotel,cameraforensics
https://t-ec.bstatic.com/images/hotel/max1280x900/413/4133974.jpg,52.5042068774823,13.326306045055402,,,,,,Germany,La ManoVerde; 181-183; Uhlandstraße; Charlottenburg; Charlottenburg-Wilmersdorf; Berlin; 10623; Germany,hotel,cameraforensics
https://live.staticflickr.com/1641/26673482676_15d7e5e4c8_o.jpg,52.50327222222222,13.32883888888889,,,,,,Germany,Haus Wien; 26; Kurfürstendamm; Charlottenburg; Charlottenburg-Wilmersdorf; Berlin; 10719; Germany,hotel,cameraforensics
https://live.staticflickr.com/2756/4095033575_781dc52d9a_o.jpg,48.72316666666666,9.10766666666667,,,,,,Germany,Studentisches Wohnen Campus Stuttgart II; Vischerstraße; Rosental; Vaihingen; Stuttgart; Baden-Württemberg; 70563; Germany,hotel,cameraforensics
https://live.staticflickr.com/7137/7606194952_fe469cdbd1_o.jpg,48.72752777777778,9.11026944444444,,,,,,Germany,Tageseinrichtung für Kinder; 23; Robert-Koch-Straße; Vaihingen; Vaihingen-Mitte; Vaihingen; Stuttgart; Baden-Württemberg; 70563; Germany,hotel,cameraforensics
https://q-cf.bstatic.com/images/hotel/max1280x900/179/179649170.jpg,48.726857,9.116758,,,,,,Germany,Trelleborg Sealing Solutions Germany GmbH; 1; Schockenriedstraße; Synergiepark; Wallgraben-West; Vaihingen; Stuttgart; Baden-Württemberg; 70565; Germany,hotel,cameraforensics
