url,latitude,longitude,date,height,width,media,copyRight,country,address,keyword,source
https://farm3.staticflickr.com/2451/3826170456_35b3c7e4e7_b.jpg,37.952251000000004,58.378772,2009-08-02 22:04:06,,,photo,0,Turkmenistan,Bus Stop; Gurban Soltan Eje (2043); Bagtyýarlyk etraby; Ashgabat; Berkararlyk etraby; 744001; Turkmenistan,hotel bathroom,flickr
https://farm5.staticflickr.com/4048/4545131532_22efd7006f_b.jpg,40.00606,52.99504200000001,2006-07-19 06:50:32,,,photo,0,Turkmenistan,Secondary School No. 14; H Arazowa köçesi; Turkmenbashy; Balkan Region; 745000; Turkmenistan,hotel bathroom,flickr
https://farm3.staticflickr.com/2713/4288229620_31d8dcd1aa_b.jpg,40.00606,52.99504200000001,2006-07-19 06:50:32,,,photo,0,Turkmenistan,Secondary School No. 14; H Arazowa köçesi; Turkmenbashy; Balkan Region; 745000; Turkmenistan,hotel bathroom,flickr
https://farm5.staticflickr.com/4051/4686661365_e6b33c6eb0_b.jpg,36.575835,62.561645,2009-10-09 11:39:01,,,photo,0,Turkmenistan,Sandykgaçy geňeşligi; Mary Region; Turkmenistan,vacation bathroom,flickr
https://farm3.staticflickr.com/2561/3825371457_b908159f8d_b.jpg,37.952251,58.378772,2009-08-02 22:04:29,,,photo,0,Turkmenistan,Bus Stop; Gurban Soltan Eje (2043); Bagtyýarlyk etraby; Ashgabat; Berkararlyk etraby; 744001; Turkmenistan,sheraton room,flickr
https://farm5.staticflickr.com/4012/5167495124_262daa2288_b.jpg,37.95042,58.39012099999999,2010-09-30 12:55:44,,,photo,0,Turkmenistan,Ashgabat; Berkararlyk etraby; 744012; Turkmenistan,sheraton room,flickr
